{
  "schema_version": "scope-manifest.v1",
  "project_id": "project_demo",
  "book_id": "book_demo",
  "scope_id": "scope_ch01",
  "source_unit_ids": ["unit_ch01_p001_010"],
  "page_ranges": [{ "page_start": 1, "page_end": 10 }],
  "selection_label": "Chapter One: The Map",
  "scope_hash": "bbbbbbbbbbbbbbbbbbbbbbbbbbbbbbbbbbbbbbbbbbbbbbbbbbbbbbbbbbbbbbbb",
  "created_by": "user_mrigesh",
  "created_at": "2026-07-19T10:00:00Z"
}
